{
  "format": "vix-json",
  "version": 2,
  "exportedAt": "2026-08-08T00:00:00.000Z",
  "target": {
    "scope": "domain",
    "domainKey": "domain_general_collocations"
  },
  "mode": "merge",
  "data": {
    "domains": [
      {
        "key": "domain_general_collocations",
        "name": "通用英语搭配",
        "order": 2,
        "glossEnabled": true,
        "contentMode": "nonStructured",
        "relationExcluded": false
      }
    ],
    "collections": [
      {
        "key": "collection_general_collocations_patterns",
        "domainKey": "domain_general_collocations",
        "name": "句型",
        "label": "",
        "kind": "normal",
        "order": 0,
        "hidden": false
      }
    ],
    "entries": [
      {
        "key": "entry:domain_general_collocations:it remains an open question whether",
        "domainKey": "domain_general_collocations",
        "text": "It remains an open question whether ...",
        "glossHans": "是否……尚有待观察",
        "glossHant": "是否……尚有待觀察",
        "glossSource": "示例",
        "sourceRefs": [
          "example"
        ],
        "kind": "content",
        "contentType": "sentence-pattern",
        "partsOfSpeech": []
      }
    ],
    "memberships": [
      {
        "entryKey": "entry:domain_general_collocations:it remains an open question whether",
        "collectionKey": "collection_general_collocations_patterns",
        "sourceLabel": "句型",
        "sourceOrder": 0
      }
    ]
  },
  "sources": [
    {
      "key": "example",
      "title": "Vocabulary Index 4.0.0 non-structured example",
      "publisher": "Vocabulary Index",
      "retrievedAt": "2026-08-08"
    }
  ]
}
